В Москве изменились ставки по торговому сбору,"Добрый день, уважаемые ИП! Совсем короткая новость для ИП из Москвы, которые платят торговый сбор. Если совсем кратко, то ставки по торговому сбору изменились с 1 июля 2019 года и были введены законом города Москвы от от 26.12.2018"
Как проверить себя по отчетности в Росстат за пару минут? ,"Добрый день, уважаемые ИП! Записал небольшое видео вдогонку к статье о проверке списка отчетности, которую нужно сдавать в Росстат. Напомню, что исходная статья находится по этой ссылке. Да, уже много раз говорил про то, что нужно регулярно отслеживать, какую отчетность необходимо сдавать в Росстат.        "
И снова про возможную отмену деклараций по УСН в 2020 году,"Добрый день, уважаемые ИП! Давно уже писал, что ФНС собирается отменить налоговые декларации по УСН для тех предпринимателей, которые применяют онлайн-кассы (ссылка в конце этой новости). При этом конкретные сроки не сообщались"
Утверждена новая форма заявления об утрате права применения ПСН,"Добрый день, уважаемые ИП! Еще в начале 2019 года писал, что готовится новая форма заявления об утрате права применения ПСН. Собственно, обновленная форма наконец-то утверждена приказом Федеральной налоговой службы от 12.07.2019 № ММВ-7-3/352@ и опубликована."
ИП стал самозанятым. Нужно ли снимать онлайн-кассу с учета в ФНС?,"Добрый день, уважаемые ИП! После запуска пилотного проекта по самозанятым многие ИП получают статус самозанятых и платят налог на профессиональный доход (НПД). Напомню, что сейчас пилотный проект запущен в четырех регионах, но со временем он распространится и на другие регионы РФ."
Еще раз про отмену ЕНВД в 2021 году,"Добрый день, уважаемые ИП! Короткая, но важная новость для тех, кто применяет ЕНВД. Уже писал, что в СМИ прошла информация о том, что ЕНВД отменят с 1 января 2021 года "
Первые новости про МРОТ на 2020 год,"Добрый день, уважаемые ИП! Небольшая новость на сегодня. МинТруд подготовил проект приказа об установлении прожиточного минимума для трудоспособного населения на второй квартал 2019 год в размере 12130 рублей. А согласно закону 421-ФЗ от 28.12.2017 МРОТ с 1 января 2020 года должен быть равен этому"
"Похоже, не будут продлевать срок действия ЕНВД после 1 января 2021 года","Добрый день, уважаемые ИП! Очень редко публикую новости про всевозможные инициативы, которые не нашли подтверждения в виде законопроекта или официального документа. Но на этот раз придется, так как, как правило, заявления министра финансов Силуанова потом реализуются в виде поправок в Налоговый Кодекс."